_gddid,pubname,publisher,title,doi,coverDate,URL,authors,highlight,hits,keywords,location,keyword
6063faf13f2ac7e70168fb1a,Tectonics,Wiley,"Triassic–Jurassic accretionary history and tectonic origin of Stikinia from U‐Pb geochronology and Lu‐Hf isotope analysis, British Columbia",10.1029/2020TC006505,,https://onlinelibrary.wiley.com/doi/10.1029/2020TC006505,"George, S.W.M.; Nelson, J.L.; Alberts, D.; Greig, C.J.; Gehrels, G.E.","[' to the Laurentian margin (Dusel-Bacon et al., 2006). Quesnellia is considered peri-Laurentian (Fig. 1', '.   Accepted Article  the Mystic subterrane of the Farewell terrane, the Okanagan subterrane of Quesnellia', ' Jurassic time as a complex collision between Stikinia, Yukon-Tanana terrane, northern Quesnellia', ', Cache Creek, and possibly Quesnellia (Colpron et al., 2015). Its fill, the Laberge Group (Lower', ' with the Quesnellia and Slide Mountain terranes farther east (Fig. 1). Collectively, these terranes are known']",5,,Quesnellia,andesite
5eefb7ada58f1dfd5209b5bf,Economic Geology,EconomicGeology,"Isotope Geochemistry of the Northeast Zone, Mount Polley Alkalic Cu-Au-Ag Porphyry Deposit, British Columbia: A Case for Carbonate Assimilation",10.2113/econgeo.109.4.859,2014 06,https://pubs.geoscienceworld.org/economicgeology/article/109/4/859-890/128654,"Pass, H. E.; Cooke, D. R.; Davidson, G.; Maas, R.; Dipple, G.; Rees, C.; Ferreira, L.; Taylor, C.; Deyell, C. L.","[' in the Triassic and Early Jurassic Quesnellia and Stikinia terranes of British Columbia, Canada', ' Setting Regional setting Mount Polley lies within the accreted island-arc terrane of Quesnellia', ' in the Canadian Cordillera (Fig. 1). Quesnellia formed on continental margin assemblages in response', ' (Mihalynuk et al., 1994; Logan and Mihalynuk, 2014). The Paleozoic rocks of Quesnellia are characterized', '–andesites  L. Triassic basaltic volcanic  rocks  M.–L. Triassic argillites,  volcaniclastic rocks  Slide']",5,,Quesnellia,andesite
5e791cbe998e17af8265f49e,Tectonics,Wiley,"Geology, U‐Pb Geochronology, and Hf Isotope Geochemistry Across the Mesozoic Alaska Range Suture Zone (South‐Central Alaska): Implications for Cordilleran Collisional Processes and Tectonic Growth of North America",10.1029/2019TC005946,2020 03,https://onlinelibrary.wiley.com/doi/abs/10.1029/2019TC005946,"Romero, Mariah C.; Ridgway, Kenneth D.; Gehrels, George E.","['‐Mississippian magmatic sources with zircon ages of 365–320 Ma that correlate with the Quesnellia‐Slide', ', Quesnellia‐Slide Mountain, and Stikinia in the Yukon and British Columbia (Figure 1), all of which', ' segments of the Stikinia and Quesnellia terranes, in southwestern Yukon (Colpron, 2015; Gordey & Makepeace', ' plutonic suites of the Yukon‐ Tanana, Stikinia, and Quesnellia terranes (204–195 Ma, 190–178 Ma, and 174', '). This convergence produced the Late Triassic‐Early Jurassic Quesnellia magmatic arc and its accretionary']",5,,Quesnellia,anorthosite
5da0227e998e17af8252fb3f,Data Series,USGS,Basement domain map of the conterminous United States and Alaska,10.3133/ds898,2015,https://pubs.usgs.gov/ds/0898/,"Lund, Karen; Box, Stephen E.; Holm-Denoma, Christopher S.; San Juan, Carma A.; Blakely, Richard J.; Saltus, Richard W.; Anderson, Eric D.; DeWitt, Ed","['° 100° 90° 80° 70°  60°  Western Quesnellia Okanogan  Cascadia  Kootenay  Pend Oreille  Medicine Hat', ' Quesnellia  ---  Okanogan  --  Crust_Type Sialic protocontinent Sialic protocontinent Sialic', '; Mueller  1.79 Ga anorthosite.  and others, 1995; Foster and  Fanning, 1997; Foster and  others, 2006', ', M.G., and Miller, M.G., 1994, Major faults, stratigraphy, and identity of Quesnellia in Washington', ' in southeastern Quesnellia, British Columbia and Washington: Geological Society of America Bulletin, v. 107, p']",5,,Quesnellia,anorthosite
5c6527551faed6554895ce3f,Journal of Paleontology,Cambridge,"Bryozoa of the Mission Argillite (Permian), northeastern Washington",10.1017/S0022336000032704,2000 07,https://www.cambridge.org/core/product/identifier/S0022336000032704/type/journal_article,"Gilmour, Ernest H.; Snyder, Edward M.","['-3360/00/0074-545$03.00 BRYOZOA OF THE MISSION ARGILLITE (PERMIAN), NORTHEASTERN WASHINGTON ERNEST H', ' in a biohermal bank in the Mission Argillite of northeastern Washington. These include two species', ' described in this report were collected from a limestone in the Mission Argillite near Kettle Falls', ' collecting trips to the biohermal bank with students. General stratigraphy.—The Mission Argillite', ' was first de\xad scribed by Weaver (1920) as consisting of calcareous argillite, banded and massive']",5,,Quesnellia,argillite
620d5257ad0e9c819b0799bf,,Geoarchive,NI 43-101 Technical Report for the Schaft Creek Project in North America dated 2007,,2007,https://www.zotero.org/groups/4530692/items/KI49XTQ2,,"[' mineralization. East to west, these are the Quesnellia, Cache Creek, and Stikina terranes. These terranes', ' Creek, Quesnellia, and Slide Mountain terranes at some time prior to final accretion with the North', ', the rock can be classified as either an albitite or an anorthosite. \x83 A multi-stage system is suggested', ' samples is that of an anorthosite or an albitite, depending on the composition of the plagioclase', ' can be classified as either an albitite or an anorthosite. Plagioclase grains of the igneous matrix']",5,,Quesnellia,anorthosite
566f707ecf58f1b1878a78c6,Journal of Geodynamics,Elsevier,True polar wander during the Permo^Triassic,10.1016/S0264-3707(98)00026-X,2 September 1999,http://www.sciencedirect.com/science/article/pii/S026437079800026X,"Marcano, Maria C; Voo, Rob Van der; Niocaill, Conall Mac","['\\ to the west of what is often referred to as the Quesnellia {terrane| ""e[g[\\ Monger et al[\\ 0883', '\\ the situation is di}erent in the displaced terranes to the west of the Quesnellia {terrane', '|\\ and in Quesnellia itself[ In the Slide Mountain area to the east of Quesnellia\\ and in Quesnellia itself', ' Columbia clearly depends on whether Quesnellia is autochthonous or whether it is a displaced terrane', '\\ pillow basalts and cherts with tu}\\ argillites\\ graywackes and lime! stones[ Some are only preserved']",5,,Quesnellia,argillite
574de644cf58f15e0336953b,Canadian Journal of Earth Sciences,Canadian Science Publishing,"Pressure – temperature and tectonic evolution of Triassic lawsonite – aragonite blueschists from Pinchi Lake, British Columbia",10.1139/e96-061,May 1996,http://www.nrcresearchpress.com/doi/abs/10.1139/e96-061,"Ghent, Edward D.; Erdmer, Philippe; Archibald, Douglas A.; Stout, Mavis Z.","[' collision of the Cache Creek terrane with Quesnellia in the Late Triassic to Middle Jurassic', ') and Ash et al. (1993). Quesnellia, Stikinia, and Cache Creek are discrete Paleozoic terranes; the Omineca', ' thickness. The dominant protolith appears to have been argillite, probably with a significant tuffaceous', ' and dark argillite and are cut by veins of quartz and carbonate. Marble is very fine grained', ' cal  cal cal XX  AP X  Mt X  X  XXX  X  Notes: mtarg, meta-argillite; mnf, metatuff; mgw']",5,,Quesnellia,argillite
57eebd70cf58f1a5c6c7ef14,Lithosphere,GSA,Detrital zircon record of mid-Paleozoic convergent margin activity in the northern U.S. Rocky Mountains: Implications for the Antler orogeny and early evolution of the North American Cordillera,10.1130/l557.1,September 2016,http://dx.doi.org/10.1130/l557.1,"Beranek, Luke P.; Link, Paul K.; Fanning, C. Mark","[', Northern Sierra, and Quesnellia terranes as likely candidates. Lower Mississippian syntectonic', ' of western Laurentian a nity Quesnellia, Stikinia (ST), other early Mesozoic arcs McCloud, Redding', ') Terranes of Siberian, Baltican, & Caledonian a nities  WR  CC SM  Alexander (AX)  Quesnellia  Arctic', ', and Quesnellia terranes (Fig. 1) that may have originally developed near Baltica or West Gondwana (Wright', ' (Eifelian to Frasnian) deposition of the Triumph argillite member during localized extensional faulting']",5,,Quesnellia,argillite
57a021d0cf58f16886bc5d18,Geological Society of America Bulletin,GSA,"Late Jurassic magmatism, metamorphism, and deformation in the Blue Mountains Province, northeast Oregon",10.1130/b30327.1,June 2011,http://dx.doi.org/10.1130/b30327.1,"Schwartz, J. J.; Snoke, A. W.; Cordey, F.; Johnson, K.; Frost, C. D.; Barnes, C. G.; LaMaskin, T. A.; Wooden, J. L.","['-grained metasedimentary rocks of the Baker terrane (e.g., Elkhorn Ridge Argillite), approximately N', ', and amphibolite Salmon River belt  Baker terrane Pz-Mz serpentinite-matrix, argillite-matrix mélange  Riggins', ' Elkhorn Ridge Argillite (early Late Jurassic) Elkhorn Ridge Argillite (Early Jurassic-Pennsylvanian', ' Argillite. At this subterrane contact, the Greenhorn subterrane is thrust over the Bourne subterrane along', ' lithologic unit of the Bourne subterrane is the Elkhorn Ridge Argillite (Pardee and Hewett, 1914']",5,,Quesnellia,argillite
58c860f0cf58f17bacda0023,International Geology Review,Taylor and Francis,"Geochemical constraints on the tectonic setting of basaltic host rocks to the Windy Craggy Cu-Co-Au massive sulphide deposit, northwestern British Columbia",10.1080/00206814.2014.947335,2014 09,http://www.tandfonline.com/doi/abs/10.1080/00206814.2014.947335,"Peter, Jan M.; Leybourne, Matthew I.; Scott, Steven D.; Gorton, Michael P.","[' and sills and calcareous argillite that are part of the Alexander terrane. The host footwall', '-grained turbiditic argillites host the Windy Craggy deposit. The goals of this study were to: (1) better', ') interbedded graphitic and calcareous argillite, massive (Figure 4(A)) and pillowed (Figure 4(B', '; calcareous and graphitic shale, argillite, and limestone of unknown age; and (5) Limestone Unit; grey', '); Quesnellia, Stikinia (eastern Panthalassic arcs in part on pericratonic basement); Slide Mountain']",5,,Quesnellia,argillite
574ea1bdcf58f1a21284d722,Canadian Journal of Earth Sciences,Canadian Science Publishing,"Crustal structure of the Valhalla complex, British Columbia, from Lithoprobe seismic-reflection and potential-field data",10.1139/e90-109,August 1990,http://www.nrcresearchpress.com/doi/abs/10.1139/e90-109,"Eaton, David W. S.; Cook, Frederick A.","[' complex bordering the suture zone between Quesnellia and North American rocks. The region', "" roches du Quesnellia et du craton de 1'AmCrique du Nord. La rCgion est tectoniquement interposke entre"", ') that are part of Quesnellia, an allochthonous t e ~ a n e obducted in Late Triassic to Middle Jurassic time', ' affinity, or volcanic and sedimentary rocks of Quesnellia, a suspect terrane (Monger et al. 1982', ' and pelites that grade upward into argillite and sandstones, overlain by carbonates and deltaic deposits']",5,,Quesnellia,argillite
55a4851de13823757cc6f271,Open-File Report,USGS,"Digital geologic map of the Sandpoint 1- by 2-degree quadrangle, Washington, Idaho, and Montana",10.3133/ofr99144,1999,https://pubs.usgs.gov/of/1999/0144/,"Miller, F.K.; Burmester, R.F.; Powell, R.E.; Miller, D.M.; Derkey, P.D.","[' the Belt Supergroup from its basement. The Belt Supergroup, a thick section of argillite, siltite', ' of argillite, siltite, quartzite, and carbonate rocks lithostratigraphically similar to the Belt', ' be related to neither feature Rocks of Quesnellia Terrane (Jurassic to Carboniferous)  Rocks west', ' argillite and wacke have yielded abundant Permian and Triassic fossils (for references, see Joseph', ' been assigned to the Quesnellia terrane (Cheney and others, 1994). Voluminous intermediate']",5,,Quesnellia,argillite
574e2206cf58f173f4683785,Canadian Journal of Earth Sciences,Canadian Science Publishing,"Source rock potential of Lower to Middle Jurassic black clastic sequences of the Intermontane belt 1 1 This article is one of a series of papers published in this Special Issue on the theme of New insights in Cordilleran Intermontane geoscience: reducing exploration risk in the mountain pine beetle-affected area, British Columbia .",10.1139/e11-036,June 2011,http://www.nrcresearchpress.com/doi/abs/10.1139/e11-036,"Ferri, Filippo; Colpron, Maurice","[' Formation and equivalent strata in central Quesnellia, and Last Creek Formation and Junction Creek rocks', ' in western Quesnellia. Résumé : Des séquences clastiques du Jurassique inférieur à moyen sont bien', ' corresponds to the closure of the Cache Creek ocean and the impingement of Stikinia and Quesnellia', ' the southern Cordillera indicate that interactions between Quesnellia and western North America occurred', ' with this was the probable double-sided closure of the Cache Creek ocean below Quesnellia and Stikinia']",5,,Quesnellia,argillite
620cf21ead0e9c819b050662,,Geoarchive,NI 43-101 Technical Report for the Bunker Hill-JJ-Connor Creek Project in North America dated 2003,,2003,https://www.zotero.org/groups/4530692/items/7SIF53G8,,"[' and phyllitic to schistose 5   6 argillites; some of the later are organic-rich. Also present are some thin', ': Au-bearing quartz-sulphide-rich mineralization hosted by argillites or skarn. This type includes', ' by a folded and steeply dipping package of metasediments that include phyllitic argillites, micaceous', ' forms from a limestone or shaly limestone precursor, whereas hornfels forms from argillite', ' the boundary between the accreted Quesnellia terrane in the west and ancestral North America']",5,,Quesnellia,argillite
620cf223ad0e9c819b050d82,,Geoarchive,NI 43-101 Technical Report for the Spanish Mountain Project in North America dated 2008,,2008,https://www.zotero.org/groups/4530692/items/FZD5N9T6,,"[' of the western margin of the Quesnellia Terrain, an upper Triassic sequence of sediments', ' and volcanic rocks. The Quesnellia Terrain is an important economic region due to the presence of several', ' approximately 11km southwest of the property. The Eureka thrust marks the contact between Quesnellia', ' identified: • Wide spread disseminated mineralization hosted in argillite, siltstone and greywacke', ' of argillite and siltstone when Skygold (operated by Wildrose) undertook an extensive exploration']",5,,Quesnellia,argillite
620d5256ad0e9c819b0797c1,,Geoarchive,NI 43-101 Technical Report for the Spanish Mountain Project in North America dated 2008,,2008,https://www.zotero.org/groups/4530692/items/9UZE3T2W,,"[' uncolored area is argillite and siltstone', ' margin of the Quesnellia Terrain, an upper Triassic sequence of sediments and volcanic rocks', '. The Quesnellia Terrain is an important economic region due to the presence of several alkalic porphyry', ' 11km southwest of the Property. The Eureka thrust marks the contact between Quesnellia', ' of mineralization have been identified: • Wide spread disseminated mineralization hosted in argillite']",5,,Quesnellia,argillite
579e6358cf58f1a29155e22b,Geological Society of America Bulletin,GSA,"Analysis of the Wallowa-Baker terrane boundary: Implications for tectonic accretion in the Blue Mountains province, northeastern Oregon",10.1130/b26493.1,October 2009,http://dx.doi.org/10.1130/b26493.1,"Schwartz, J. J.; Snoke, A. W.; Frost, C. D.; Barnes, C. G.; Gromet, L. P.; Johnson, K.","[', imbricated slabs and slices of metaigneous and metasedimentary rocks faulted into chert-argillite mélange', ' of the Elkhorn Ridge Argillite. Metaplutonic rocks within tectonic units in this zone crystallized', ' εNd values (+7.7 to +8.5). In contrast, siliceous argillites from the chert-argillite mélange have', ' in argillite-matrix mélange) in the Baker terrane and its signiﬁcance in the deformational history', '  Triassic conglomerate/grit, sandstone, argillite, and limestone of the Badger Creek metasedimentary']",5,,Quesnellia,argillite
5fce9eef78f934caa327935e,Gondwana Research,Elsevier,"Polyphase brittle and ductile deformation of Late Jurassic ophiolitic basalt-argillite matrix mélange and stratigraphic overlap sequence, northwestern Washington State",10.1016/j.gr.2019.01.005,October 2019,https://www.sciencedirect.com/science/article/pii/S1342937X19300371,"Oldow, John S.","[' Jurassic ophiolitic basalt-argillite matrix mélange and stratigraphic overlap sequence, northwestern', ' conglomerate which range in size from a meter to over 1 km and are contained within a matrix of argillite', ' clasts of plagiogranite, gabbro, tonalite, chert, and basalt into argillite containing Late Jurassic', ' radiolarians. The argillite is overlain by poorly-sorted greywacke and conglomerate with clast', ' and ultramaﬁc plutonic and hypabyssal rocks, plagiogranite, andesite and basalt, argillite']",5,,Quesnellia,argillite
56e366abcf58f1744b8015cf,Tectonics,Wiley,"Tectonic setting of the Slide Mountain terrane, southern British Columbia",10.1029/94TC01032,October 1994,http://doi.wiley.com/10.1029/94TC01032,"Roback, Robert C.; Sevigny, James H.; Walker, Nicholas W.","[' allochthonouseugeoclinal and ensimatic arc rocks of the Kootenay, Slide Mountain, and Quesnellia', ' is unconformablyoverlain by Late Triassic finegrained sedimentaryrocks (Slocan Group) of the Quesnellia terrane [Monger', ' is depositionallyoverlainby Late Triassic rocks of the ensimatic arc terrane Quesnellia [Klepacki, 1985', ' of Quesnellia.   ROBACK ET AL.: SLIDE MOUNTAIN TERRANE  1245  NORTHERN KOOTENAY ARC  [Roback, 1993] is a lens', ', calcareous argillite, limestoneand conglomeratea; middlesequencedominatedby limestone']",5,,Quesnellia,argillite
578b802bcf58f161edaeeb52,Geol,GSA,Escape hypothesis for the Stikine block,10.1130/0091-7613(1988)016<0461:ehftsb>2.3.co;2,1988,http://dx.doi.org/10.1130/0091-7613(1988)016<0461:ehftsb>2.3.co;2,"Wernicke, Brian; Klepacki, David W.","[' to this assemblage lie both inboard (Quesnellia terrane) and outboard (Stikine terrane) of subduction', '  461   southeastern British Columbia, Carboniferous clastics of Quesnellia include boulders', ' American margin (Klepacki, 1985); this ties Quesnellia to North America. A number of terranes belonging', '-Mississippian basic volcanics; Mississippian-Pennsylvanian eugeoclinal clastics (siliceous argillites', '., 1984; Klepacki, 1985). Because Quesnellia can now be tied to North America, and these other areas']",5,,Quesnellia,argillite
578d6684cf58f11c9ffc4658,Geological Society of America Bulletin,GSA,"Geology of the Duncan Canal shear zone:Evidence for Early to Middle Jurassic deformation of the Alexander terrane, southeastern Alaska",10.1130/0016-7606(1990)102<1378:gotdcs>2.3.co;2,October 1990,http://dx.doi.org/10.1130/0016-7606(1990)102<1378:gotdcs>2.3.co;2,"MCCLELLAND, WILLIAM C.; GEHRELS, GEORGE E.","[' volcanic rocks within a thick section of argillite and graywacke (Fig. 2). Conodonts and megafossils', ' assemblage is dominated by thick sections of basinal clastic rocks (Devonian?-Triassic? argillite', ' and graywacke on Fig. 2 and subsequent figures) that include (1) argillite with thin siltstone', ' and limestone interbeds; (2) siliceous argillite with thinly interlayered chert; (3) light green and gray', ' OF ALEXANDER TERRANE, ALASKA  1379  DCSZ and the lack of age control and marker horizons in the argillite']",5,,Quesnellia,argillite
578f75d6cf58f1ada1d9f66a,Geol,GSA,"Long-lived Panthalassic remnant: The Bridge River accretionary complex, Canadian Cordillera",10.1130/0091-7613(1993)021<0263:llprtb>2.3.co;2,1993,http://dx.doi.org/10.1130/0091-7613(1993)021<0263:llprtb>2.3.co;2,"Cordey, Fabrice; Schiarizza, Paul","[' = Rocky Mountain belt; S = Stikinia; CC = Cache Creek; Q = Quesnellia.  GENERAL GEOLOGY', ' with argillite, minor limestone, sandstone, conglomerate, serpentinite, and gabbro (Potter, 1986', ' consists of predominantly gray (in places red, green, or black) chert beds with argillite partings', ' are in tuffaceous argillite (Cordey et al., 1987) and, thus, record a different type of sedimentation', ')  Middle Jurassic (early-middle Callovian)  11 o: gray ribbon chert, argillite, Andromeda']",5,,Quesnellia,argillite
578ac82ecf58f12de254ca4f,Geol,GSA,"Significance of Jurassic radiolarians from the Cache Creek terrane, British Columbia",10.1130/0091-7613(1987)15<1151:sojrft>2.0.co;2,1987,http://dx.doi.org/10.1130/0091-7613(1987)15<1151:sojrft>2.0.co;2,"Cordey, Fabrice; Mortimer, N.; DeWever, Patrick; Monger, J.W.H.","[' terrane and Quesnellia (parts of superterrane I) in southern British Columbia. The new Jurassic', ', all in a variably sheared matrix of argillite (Shannon, 1981). Fusulinids, conodonts, and radiolarians', ' of the tectonostratigraphic terrane Quesnellia to the east (Monger and McMillan, 1984). Conglomerate, sandstone, and shale', ' and subordinate chert, argillite, and volcanic rocks. Conodonts and radiolarians from the central', '; Monger et al., 1982; Danner, 1985). The western belt consists mainly of chert, argillite, and siliceous']",5,,Quesnellia,argillite
5750699dcf58f187509930f8,Canadian Journal of Earth Sciences,Canadian Science Publishing,"U–Pb and K–Ar dates related to the timing of magmatism and deformation in the Cache Creek terrane and Quesnellia, southern British Columbia",10.1139/e90-009,January 1990,http://www.nrcresearchpress.com/doi/abs/10.1139/e90-009,"Mortimer, N.; Heyden, P. van der; Armstrong, R. L.; Harakal, J.","[' in the Cache Creek terrane and Quesnellia, southern British Columbia N. MORTIMER New Zealand Geological', ' Creek terrane and Ashcroft Formation argillites range from Early Permian (266 + 8 Ma) and Early', ' Columbia. The area investigatedincludesthe Cache Creek and Quesnellia tectono-stratigraphicterranes (Fig', '. 1) (Monger et al. 1982). In the area of Fig. 1, Quesnellia consists of the Early Triassicto Early', '), Early to Late Triassic limestone, chert, argillite, and volcaniclastic rocks, and Early to Middle']",5,,Quesnellia,argillite
55d13537cf58f1b3b25e3610,Earth and Planetary Science Letters,Elsevier,"The odyssey of the Cache Creek terrane, Canadian Cordillera: Implications for accretionary orogens, tectonic setting of Panthalassa, the Pacific superwell, and break-up of Pangea",10.1016/j.epsl.2006.11.002,30 January 2007,http://www.sciencedirect.com/science/article/pii/S0012821X06007904,"Johnston, S.T.; Borel, G.D.","[' to the Stikinia– Quesnellia oceanic arc, which occurred at about 230 Ma, took place in western Panthalassa', ' previously imbricated strata of the Quesnellia arc terrane, the pericratonic belt and the outboard', ' location of the Stikinia–Quesnellia arc, taken from Mihalynuk et al. [16], is indicated by a grey band', ') the Cache Creek accretionary complex, (2) the Stikinia–Quesnellia arc, (3) the pericratonic belt, and (4', ' and Quesnellia arcs (Fig. 1), and is  interpreted as the accretionary prism that developed during']",5,,Quesnellia,argillite
578f23cdcf58f198c2e61be1,Geol,GSA,Cache Creek ocean: Closure or enclosure?,10.1130/0091-7613(1993)021<0173:ccocoe>2.3.co;2,1993,http://dx.doi.org/10.1130/0091-7613(1993)021<0173:ccocoe>2.3.co;2,"Nelson, JoAnne; Mihalynuk, Mitch","[' Cordillera. Our solution to the problem invokes a northern join between the Stikinia and Quesnellia arcs', ' involves (1) collision of a linear oceanic plateau at the cusp between Quesnellia and Stikinia, (2', ' enclosure of the Cache Creek ocean, and (4) emplacement of Quesnellia onto the margin of ancestral North', ' and both northern Stikinia and Quesnellia, the striking similarity between Triassic-Jurassic arcs east', ' to terranes, such as Quesnellia, inboard (east) of the Cache Creek. Previous attempts to explain the Cache']",5,,Quesnellia,argillite
5d4f9a720b45c76cafa461e7,Professional Paper,USGS,"Geology of the Blue Mountains region of Oregon, Idaho, and Washington; petrology and tectonic evolution of pre-Tertiary rocks of the Blue Mountains region",10.3133/pp1438,1995,https://pubs.er.usgs.gov/publication/pp1438,"Brooks, H.C.","[', then conformable  gabbro, troctolite, norite, and anorthosite. Deposition- attitudes between them and the diabase', ']  of the  CM55  CM56  CM57  CM58  CM28  CM34  CM35  OC277  Rock type  Anorthositic Foliated  gabbro', '  anorthositic  gabbro  Foliated gabbroic anorthosite  Foliated Cumulate Cumulate Cumulate  gabbroic', '  gabbro anorthositic anorthositic  anorthosite  gabbro  gabbro  Olivineplagioclase cumulate (troctolite', ' peridotites and gabbros unit. Websterite, melagabbro, gabbro, troctolite, anorthosite, dunite, and rare']",5,,Quesnellia,anorthosite
5590a2c4e13823109f3ef10d,Professional Paper,USGS,"Geology of the Blue Mountains region of Oregon, Idaho, and Washington; petrology and tectonic evolution of pre-Tertiary rocks of the Blue Mountains region",,1995,https://www.sciencebase.gov/catalog/item/4f4e4ad4e4b07f02db683155,"Edited by Vallier, T. L.; Brooks, H. C.","[', then conformable  gabbro, troctolite, norite, and anorthosite. Deposition- attitudes between them and the diabase', ']  of the  CM55  CM56  CM57  CM58  CM28  CM34  CM35  OC277  Rock type  Anorthositic Foliated  gabbro', '  anorthositic  gabbro  Foliated gabbroic anorthosite  Foliated Cumulate Cumulate Cumulate  gabbroic', '  gabbro anorthositic anorthositic  anorthosite  gabbro  gabbro  Olivineplagioclase cumulate (troctolite', ' peridotites and gabbros unit. Websterite, melagabbro, gabbro, troctolite, anorthosite, dunite, and rare']",5,,Quesnellia,anorthosite
