_gddid,pubname,publisher,title,doi,coverDate,URL,authors,highlight,hits,keywords,location,keyword
5750ecd9cf58f1b8cc00d4b3,Canadian Journal of Earth Sciences,Canadian Science Publishing,Nd–Sr isotopic constraints on the interactions of the Intermontane Superterrane with the western edge of North America in the southern Canadian Cordillera,10.1139/e95-136,October 1995,http://www.nrcresearchpress.com/doi/abs/10.1139/e95-136,"Ghosh, Dipak K.","[' in the Paleozoic oceanic crust of Quesnellia (E,, = +2.9 to +9.3) prior to its obduction over', ', and early Tertiary), the granitoids from western Quesnellia show primitive isotopic compositions', ', and those from eastern Quesnellia show eastward-increasing crust-contaminated compositions. The contaminated', ' characters of the Middle-Late Jurassic (180- 150 Ma) granitoids from eastern Quesnellia (rNd= +2.8', ' to -9.1; 87Sr/86Sr= 0.7041-0.7083) suggest that by 180 Ma, the eastern part of Quesnellia obducted']",5,,Quesnellia,amphibolite
620e3ea2ad0e9c819b0b7cc6,,Geoarchive,NI 43-101 Technical Report for the Biricu Project in North America dated 2014,,2014,https://www.zotero.org/groups/4530692/items/7HDVTNTB,,"[' in the intrusive and adjacent Mezcala hornfels host  Leopold J. Lindinger, P.Geo. 680 Dairy Road, Kamloops', ' skarn and/or hornfels often with accompanying anomalous gold-arsenic values. Also discovered', ' have hornfelsed the surrounding clastic sediments into biotite and diopsidic hornfels and minor', ' the intrusives and hornfels. Disseminated pyrite is often present in the intrusives. At Los Filos', ' in Quesnellia. COMMENTS: Most Au skarns throughout the world are calcic and are associated with island arc']",5,,Quesnellia,hornfel
620ec50bad0e9c819b0ed7c8,,Geoarchive,NI 43-101 Technical Report for the Molly Gibson Project in Canada dated 2018,,2018,https://www.zotero.org/groups/4530692/items/RCHKVQUW,,"[' Quesnellia, a terrane which accreted to North America during the mid-Jurassic. Proterozoic', ' lime hornfels. North of Mollie Creek, well bedded argillaceous limestone dominates the limestone', ' limestone and lime hornfels units dominate, again with lesser coarsely crystalline marble. In this area', ' massive to thinly bedded hornfels, which contains disseminations and stringers of pyrite and pyrrhotite', '/t Ag, 11.8% Pb and 12.5% Zn, with anomalous As and Sb. A sample of rusty hornfels nearby assayed']",5,,Quesnellia,hornfel
620d525aad0e9c819b079c31,,Geoarchive,NI 43-101 Technical Report for the Mount Thomlinson Project in North America dated 2007,,2007,https://www.zotero.org/groups/4530692/items/388BRKXN,,"[', and Quesnellia terrains.  Molystar Resources Inc., Vancouver BC. Mount Thomlinson Project. Omineca Mining', ' molybdenite and scheelite. Mineralization also extends into the hornfels zone, which is up to 300', ' intrude the hornfels and quartz diorite. Silicification, together with kaolinitic, chloritic', '  stockwork, quartz veins  A. bi hornfels + skarn B. 1. K-fs, bi silic 2. qz, ab, ep 3. py halo  1. qz, po', ', quartz veins  A. bi hornfels B. 1. inner K-fs, bi 2. peripheral ser, py  1. barren qz 2. qz, mo (py) 3']",5,,Quesnellia,hornfel
620cf21cad0e9c819b0504e8,,Geoarchive,NI 43-101 Technical Report for the Stardust Project in North America dated 2018,,2018,https://www.zotero.org/groups/4530692/items/XMASSMXJ,,"[' hornfels and skarn increases towards the stock (Evans, 1998). Some of the intrusive phases contain', ', is highly variable in type and in scale. The major alteration types are: 1. Skarnoid or hornfels', ' typically forms from a limestone or shaly limestone precursor, whereas hornfels forms from shale', ' or limy shale precursors. Hornfels and skarnoid commonly develop in the thermal aureole around', ' events. Hornfels mineralogy may be zoned with respect to the thermal center, commonly with pyroxenes']",5,,Quesnellia,hornfel
620d525aad0e9c819b079c3b,,Geoarchive,NI 43-101 Technical Report for the Copper Mountain Project in North America dated 2009,,2009,https://www.zotero.org/groups/4530692/items/78IVV4QP,,"[' is part of a northerly trending Mesozoic tectonostratigraphic terrane termed Quesnellia, composed', ', oceanic sedimentary-volcanic complex (Harper Ranch and Okanogan sub-terranes). Quesnellia was formed off', ' America in late Mesozoic times (Monger et al., 1992). The principle rock formation of Quesnellia', ' at Copper Mountain is a hornfels produced within the volcanic rocks adjacent to the Copper Mountain', ' Stock. The hornfels appears to affect only the intermediate to mafic volcanic flows and pyroclastic']",5,,Quesnellia,hornfel
620c0472ad0e9c819b01e9df,,Geoarchive,NI 43-101 Technical Report for the Stardust Project in Canada dated 2021,,2021,https://www.zotero.org/groups/4530692/items/UEHQ3M8I,,"[' and the Quesnellia Terrane, which includes and Jurassic Hogem Batholith and Triassic-Jurassic Takla rocks', ' and the Quesnellia Terrane, which includes and Jurassic Hogem Batholith and Triassic-Jurassic Takla', ' of Biotite hornfels and skarn increases towards the stock (Evans, 1998) within the Canyon Creek Skarn Zone', ' and in scale. The major alteration types are: 1. Skarnoid or hornfels: These are typically very fine', ' or shaly limestone precursor, whereas hornfels forms from shale or limy shale precursors. Hornfels']",5,,Quesnellia,hornfel
620cf21dad0e9c819b050520,,Geoarchive,NI 43-101 Technical Report for the Toodoggone Region Project in North America dated 2004,,2004,https://www.zotero.org/groups/4530692/items/5G8SX7SI,,"['. In Pennsylvanian time the older parts of the Stikinia-Quesnellia arc, i.e. the Stikine Assemblage including', '). The Stikinia-Quesnellia island arc continued to form offshore of North America with ongoing subduction', ' Creek terrane. The Stikinia-Quesnellia arc and subduction zones continued to form in Early to mid', '-Quesnellia arc, granitic plutons coeval with 21   Hazelton volcanic rocks were emplaced as the initial', ' and metasomatism, to hornfels, garnet-biotite-muscovite schist, calc-silicate hornfels and skarn. 33']",5,,Quesnellia,hornfel
620db66dad0e9c819b097cf4,,Geoarchive,NI 43-101 Technical Report for the Jesse Creek Project in North America dated 2012,,2012,https://www.zotero.org/groups/4530692/items/A27A3GNN,,"[' to monzodioritic to dioritic intrusions have been thermal metamorphosed and/or metasomatized to hornfels', ' the Intermontane Belt, part of Quesnellia, which is juxtaposed to the east against the metamorphic rocks', ' intrusions have been thermal metamorphosed and/or metasomatized to hornfels or local epidote-calcite', ' zones of calc-silicate hornfels with pyrrhotite and minor chalcopyrite were intersected in Hole 95-4', ' averaging 0.35% copper and anomalous gold (22ppb). Wide zones of calc-silicate hornfels with pyrrhotite']",5,,Quesnellia,hornfel
5eefa741a58f1dfd5209b520,Economic Geology,EconomicGeology,"The Red Chris Porphyry Copper-Gold Deposit, Northern British Columbia, Canada: Igneous Phases, Alteration, and Controls of Mineralization",10.2113/econgeo.110.4.857,2015 06,https://pubs.geoscienceworld.org/economicgeology/article/110/4/857-888/128728,"Rees, C.; Riedell, K. B.; Proffett, J. M.; Macpherson, J.; Robertson, S.","[' hornfels are entrapped within the stock. Minor postmineral, weakly altered mafic dikes cut the stock', ' predominantly of the accreted Stikinia and Quesnellia island-arc terranes. These formed in the late', '), highlighting the Stikinia (ST) and Quesnellia (QN) island-arc terranes of the Intermontane belt, west', ' chocolate-brown quartz-biotite-K feldspar hornfels (Fig. 6A). Clots of fine biotite impart the brown color', '. Gray to tan siliceous hornfels replaces siltstones and sandstones. The upper subunit is exposed']",5,,Quesnellia,hornfel
620d525bad0e9c819b079d32,,Geoarchive,NI 43-101 Technical Report for the Copper Mountain Project in North America dated 2007,,2007,https://www.zotero.org/groups/4530692/items/MS7PSD2U,,"['-gold camp is part of a northerly trending Mesozoic tectonostratigraphic terrane termed Quesnellia', '). Quesnellia was formed off-shore to the southwest of continental North America and accreted, with other', ' of Quesnellia is the Late Triassic Nicola Group, a predominately subaqueous island-arc assemblage', ' at Copper Mountain. The earliest alteration assemblage at Copper Mountain is a hornfels produced within', ' the volcanic rocks adjacent to the Copper Mountain Stock. The hornfels appears to affect only']",5,,Quesnellia,hornfel
620cf21bad0e9c819b050370,,Geoarchive,NI 43-101 Technical Report for the Copper Mountain Project in North America dated 2007,,2007,https://www.zotero.org/groups/4530692/items/F6X9AFRW,,"[' Quesnellia, composed of a volcanic arc with overlying sedimentary sequences, all of which were', '). Quesnellia was formed off-shore to the southwest of continental North America and accreted', ' formation of Quesnellia is the Late Triassic Nicola Group, a predominately subaqueous island-arc', ' Mountain. The earliest alteration assemblage at Copper Mountain is a hornfels produced within', ' the volcanic rocks adjacent to the Copper Mountain Stock. The hornfels appears to affect only']",5,,Quesnellia,hornfel
620cf21bad0e9c819b050345,,Geoarchive,NI 43-101 Technical Report for the Copper Mountain Project in North America dated 2007,,2007,https://www.zotero.org/groups/4530692/items/FMXCPVVC,,"[' tectonostratigraphic terrane termed Quesnellia, composed of a volcanic arc with overlying   9 sedimentary', ' Ranch and Okanogan sub-terranes). Quesnellia was formed off-shore to the southwest of continental North', '., 1992). The principle rock formation of Quesnellia is the Late Triassic Nicola Group', ' at Copper Mountain is a hornfels produced within the volcanic rocks adjacent to the Copper Mountain', ' Stock. The hornfels appears to affect only the intermediate to mafic volcanic flows and pyroclastic']",5,,Quesnellia,hornfel
620db66dad0e9c819b097ca2,,Geoarchive,NI 43-101 Technical Report for the Lustdust Project in North America dated 2012,,2012,https://www.zotero.org/groups/4530692/items/Q46SJVWG,,"[' IN THE FRONT-MOST SECTION IS INTERPRETED TO BE HORNFELS METAMORPHISM AS MAPPED AT SURFACE. THE WESTERN', '). Biotite hornfels metamorphism is mapped to the north and west of the intrusion. Skarn is common where', ' carbonate or carbonate-rich rocks have been intruded. Both hornfels and skarn metamorphism increase', ' and it is more likely to be associated with mineralization when combined with other alterations. Hornfels', ' and in scale. The major alteration types are: 1. Skarnoid or hornfels: These are typically very fine']",5,,Quesnellia,hornfel
5794f1bfcf58f11a596f8a5a,Geological Society of America Bulletin,GSA,"Petrogenesis of the Cretaceous Cassiar batholith, Yukon–British Columbia, Canada: Implications for magmatism in the North American Cordilleran Interior",10.1130/0016-7606(2000)112<1119:potccb>2.3.co;2,July 2000,http://dx.doi.org/10.1130/0016-7606(2000)112<1119:potccb>2.3.co;2,"Driver, Leslie Ann; Creaser, Robert A.; Chacko, Thomas; Erdmer, Philippe","[' Plutons  Accreted Terranes QN: Quesnellia CC: Cache Creek ST: Stikinia Suspect Terranes KO: Kootenay SM', ' quartz monzodiorite; BtQS—biotite quartz syenite; sch—schist; Amph—amphibolite; Hfl—hornfels; QFG', ' quartzite and andalusite-bearing schist and hornfels. The presence of andalusite implies', '- ples of pelitic schists, hornfels, and amphibolite have radiogenic isotopic compositions: 87Sr', '; BtHblQmd—biotite hornblende quartz monzodiorite; Sch—schist; Amph—amphibolite; Hfl—hornfels; QFG']",5,,Quesnellia,hornfel
620cf21dad0e9c819b050645,,Geoarchive,NI 43-101 Technical Report for the Amazing Grace Project in North America dated 2005,,2005,https://www.zotero.org/groups/4530692/items/ZHFBVBHE,,"[' Grace is located within the Quesnellia terrane of the southern Omineca Belt. The property area', ' staking”.   16 5.0 Geology 5.1 Regional Geology The Amazing Grace is located within the Quesnellia', ' is part of a continental magmatic arc emplaced during obduction of Quesnellia terrane onto', ' skarn or “hornfels” occurrence. 6.1 Vein and “Lode”-style Gold Deposits The High Grade Showing', ' mineral lattice forming new minerals. A related deposit type is “hornfels” –style mineralization, caused']",5,,Quesnellia,hornfel
620ddab1ad0e9c819b09fbca,,Geoarchive,NI 43-101 Technical Report for the Chuchi Project in North America dated 2004,,2004,https://www.zotero.org/groups/4530692/items/A5SCV9ZG,,"[' Quesnellia a northwest trending belt of Late TriassicEarly Jurassic volcanic and related sedimentary rocks', ' is situated within Quesnellia a northwest trending belt of Late TriassicEarly Jurassic volcanic', ' mineralization typical of alkaline porphyry copper-gold deposits found elsewhere in Quesnellia', '. The sedimentary rocks show an extensive and strong pervasive biotite hornfels overprint, with subsequent', ': Petrochemistry of Shoshonitic Rocks Associated with Porphyry Copper-gold Deposits of Central Quesnellia']",5,,Quesnellia,hornfel
620cf21bad0e9c819b05029d,,Geoarchive,NI 43-101 Technical Report for the Bradshaw Project in North America dated 2005,,2005,https://www.zotero.org/groups/4530692/items/AZEJ79PM,,"[' of B.C., and is underlain by rocks of the Okanagan sub-terrane of Quesnellia. The Bradshaw property', ' in silicified and pyritized hornfels. This adit is believed to date back to the turn of the century', ' and pyritized hornfels is exposed in an old caved-in adit. The alteration is in contact', ' skarn? occur within biotite hornfels. Molybdenite and powellite were observed in a prominently veined', ' that are amongst the oldest stratified rocks comprising the Quesnel terrane, or Quesnellia, which']",5,,Quesnellia,hornfel
620ddab3ad0e9c819b0a00e3,,Geoarchive,NI 43-101 Technical Report for the CHES Project in North America dated 2009,,2009,https://www.zotero.org/groups/4530692/items/TMACT7DZ,,"['. Steep dipping bedded hornfels-exoskarn with a 0.6 meter thick unit of semi-massive sulfide Photo 3: Exo', ' stockwork zone. Hornfels cut by quartz-pyrite ± molybdenite-chalcopyrite veins and stockworks  LIST', ' the bedded hornfels. His work also indicates the presence of several late, brittle faults with at least', ' is at least 1 kilometer wide and comprises calc-silicate and biotite hornfels which is locally', ' overprinted by garnet-pyroxeneepidote skarn. At least two types of skarn-hornfels-hosted mineralization']",5,,Quesnellia,hornfel
620cf21dad0e9c819b05064a,,Geoarchive,NI 43-101 Technical Report for the Bunker Hill Project in North America dated 2008,,2008,https://www.zotero.org/groups/4530692/items/C6VTC4TJ,,"[' hornfels and skarns.  Aurifer Capital Corp. (“Aurifer”) has an option to purchase 100% of the Property', ' Proterozoic to Tertiary rocks along the boundary between the accreted Quesnellia terrane in the west', ' Cretaceous times when Quesnellia was accreted onto ancestral North America. This led to Quesnellia', ' of the property, is situated within volcanic arc rocks of Quesnellia. Massive pyrrhotite-pyrite', '. The metasediments near the contact display hornfels alteration. This has been noted in argillaceous']",5,,Quesnellia,hornfel
620cf21dad0e9c819b050567,,Geoarchive,NI 43-101 Technical Report for the Fran Project in North America dated 2006,,2006,https://www.zotero.org/groups/4530692/items/FGA9IIS2,,"[' and patchy semimassive to massive sulfide replacements occur within the proximal sediments and hornfels', ' to monzonite dykes and stocks (high K, calc-alkaline) and often occurs proximal to hornfels contact', ' deformed intrusive and hornfels country rocks proximal to contacts. Several of the intersections, 0.6', ' holes, minimal in others? Long intervals of pyritic-altered biotite hornfels and monzodiorite had', ' and stocks. The country rocks have been converted to hornfels locally and contain abundant biotite']",5,,Quesnellia,hornfel
620d525bad0e9c819b079dde,,Geoarchive,NI 43-101 Technical Report for the Kwanika Project in North America dated 3011,,3011,https://www.zotero.org/groups/4530692/items/HKRDCFC7,,"[' in the northern part of the Upper Triassic to Lower Jurassic Quesnellia Terrane (Quesnel Trough). The Quesnel', ' Columbia. In the area around the Kwanika property, Quesnellia is bounded by the Pinchi fault', ' of the Upper Triassic to Lower Jurassic Quesnellia Terrane (Quesnel Trough) which comprises a belt', ' Columbia (Figure 7-1). In the area around the Kwanika property, Quesnellia is bounded by the Pinchi', ' Monzodiorite Diorite, minor Gabbro, Pyroxenite, Hornblendite  Serengeti Resources Inc. – Kwanika']",5,,Quesnellia,hornblendite
620cf21dad0e9c819b0505db,,Geoarchive,NI 43-101 Technical Report for the Kwanika Project in North America dated 2010,,2010,https://www.zotero.org/groups/4530692/items/QZ5IR3HV,,"[' Quesnellia Terrane (Quesnel Trough). The Quesnel Trough is the host of numerous alkalic and calc', ', Quesnellia is bounded by the Pinchi fault on the west and by the Manson fault on the east. Porphyry', ' The Kwanika property lies in the northern part of the Upper Triassic to Lower Jurassic Quesnellia Terrane', ', Quesnellia is bounded by the Pinchi fault on the west and by the Manson fault on the east', ', Pyroxenite, Hornblendite  Serengeti Resources Inc. – Kwanika Project Technical Report NI 43-101 – March 4']",5,,Quesnellia,hornblendite
620cf21dad0e9c819b0505de,,Geoarchive,NI 43-101 Technical Report (PEA) for the Kwanika Project in North America dated 2017,,2017,https://www.zotero.org/groups/4530692/items/RQRTFUQH,,"[' The Kwanika property lies in the northern part of the Upper Triassic to Lower Jurassic Quesnellia', ' coppergold deposits within British Columbia. In the area around the Kwanika property, Quesnellia', ' The Kwanika property lies in the northern part of the Upper Triassic to Lower Jurassic Quesnellia', ', Quesnellia is bounded by the Pinchi fault on the west and by the Manson fault on the east. The Pinchi', ' Plagioclase Porphyry Monzonite Monzodiorite  Diorite, minor Gabbro, Pyroxenite, Hornblendite  NI43']",5,,Quesnellia,hornblendite
620cf21dad0e9c819b0505d8,,Geoarchive,NI 43-101 Technical Report for the Kwanika Project in North America dated 2009,,2009,https://www.zotero.org/groups/4530692/items/2ERJK8TW,,"[' The Kwanika property lies in the northern part of the Upper Triassic to Lower Jurassic Quesnellia Terrane', ' Triassic to Lower Jurassic Quesnellia Terrane (Quesnel Trough) which comprises a belt of Lower Mesozoic', '). In the area around the Kwanika property, Quesnellia is bounded by the Pinchi fault on the west', ', minor Gabbro, Pyroxenite, Hornblendite  PROPERTY GEOLOGY The Kwanika Project consists of two', ' occur in both the Quesnellia and Stikinia terrains and in post-accretionary settings']",5,,Quesnellia,hornblendite
620cf21dad0e9c819b0505ca,,Geoarchive,NI 43-101 Technical Report for the Kwanika Project in North America dated 2016,,2016,https://www.zotero.org/groups/4530692/items/2RTQAWPR,,"[' The Kwanika property lies in the northern part of the Upper Triassic to Lower Jurassic Quesnellia Terrane', ' deposits within British Columbia. In the area around the Kwanika property, Quesnellia is bounded', ' Quesnellia Terrane (Quesnel Trough) which comprises a belt of Lower Mesozoic volcanic rocks', ' the Kwanika property, Quesnellia is bounded by the Pinchi fault on the west and by the Manson fault', ' Lakes Plagioclase Porphyry Monzonite Monzodiorite Diorite, minor Gabbro, Pyroxenite, Hornblendite  MN']",5,,Quesnellia,hornblendite
5794ebe2cf58f118fa10ee18,Geological Society of America Bulletin,GSA,"Petrogenesis of the Cretaceous Cassiar batholith, Yukon-British Columbia, Canada: Implications for magmatism in the North American Cordilleran Interior",10.1130/0016-7606(2000)112<1119:potccb>2.0.co;2,July 2000,http://dx.doi.org/10.1130/0016-7606(2000)112<1119:potccb>2.0.co;2,"Driver, L. A.; Creaser, R. A.; Chacko, T.; Erdmer, P.","[' Plutons  Accreted Terranes QN: Quesnellia CC: Cache Creek ST: Stikinia Suspect Terranes KO: Kootenay SM', ' quartz monzodiorite; BtQS—biotite quartz syenite; sch—schist; Amph—amphibolite; Hfl—hornfels; QFG', ' quartzite and andalusite-bearing schist and hornfels. The presence of andalusite implies', '- ples of pelitic schists, hornfels, and amphibolite have radiogenic isotopic compositions: 87Sr', '; BtHblQmd—biotite hornblende quartz monzodiorite; Sch—schist; Amph—amphibolite; Hfl—hornfels; QFG']",5,,Quesnellia,hornfel
620ed91aad0e9c819b0f2a7b,,Geoarchive,NI 43-101 Technical Report for the Chuchi South Project in Canada dated 2020,,2020,https://www.zotero.org/groups/4530692/items/9QZSCFTQ,,"[' South claims September 9,, 2020. ...........................................3 FFigure 2: Quesnellia', ' of Quesnellia and Stikinia: Hazelton, Rossland Groups and other successions Late Triassic island arc', ' assemblages of Quesnellia and Stikinia: Takla, Nicola, and Stuhini Groups Quesnellia and Stikinia', ' - Early Mesozoic oceanic assemblages  Figure 2: Quesnellia Porphyry Belt The Chuchi South Property', ', PGeo.   Post-accretionary units Tertiary basalt Quesnellia Early Jurassic intrusions  Hogem Batholith']",5,,Quesnellia,hornfel
57e99490cf58f1a1d00333f8,Lethaia,Wiley,Biogeography of the Late Triassic wallowaconchid megalodontoid bivalves,10.1080/00241160500333431,2005 12,http://doi.wiley.com/10.1080/00241160500333431,"Yancey, Thomas; Stanley, George; Piller, Werner; Woods, Mark","[' are smaller in size than the type species described from the Black Marble quarry discovery site', ' of variation for Wallowaconcha raylenea present in the Black Marble quarry population in the Wallowa', ' is the mode of occurrence for wallowaconchids in the Black Marble quarry, Oregon (Wallowa terrane', ' of Stikinia and Quesnellia (Yarnell 2000). Since both Stikinia and Quesnellia are interpreted to have', ' wallowaconchids of the nearby Yukon area of the Stikine terrane or the Black Marble Quarry site']",5,,Quesnellia,marble
620d5259ad0e9c819b079ad9,,Geoarchive,NI 43-101 Technical Report for the Jumping Josephine Project in North America dated 2009,,2009,https://www.zotero.org/groups/4530692/items/RBR83573,,"[' from compression and associated thrusting of Quesnellia rocks over the North American plate. Melting', '-grained, greenish ‘basalt’ dykes, biotite rich, lamprophyre dyke and fine– grained, equigranular ‘diabase', ', often adjacent to coincident lamprophyre dykes (JJ Main), and more distal styles, including Au dominant', ' relatively unaltered fine grained monzonite cut by numerous lamprophyre dykes. Contacts and small', ' in the second, southern trench and the target zone was thought to be cut-off by late lamprophyre']",5,,Quesnellia,lamprophyre
620d5259ad0e9c819b079ad2,,Geoarchive,NI 43-101 Technical Report for the Greenwood Project in North America dated 2017,,2017,https://www.zotero.org/groups/4530692/items/S2NCQE4V,,"[' physiographic belt and is underlain by rocks of Quesnellia, accreted to North America during the mid', ' Fe-carbonate alteration to listwanite. The close association between serpentinite, the Old Diorite', '-chalcopyrite in serpentinite and listwanite along the regional Snowshoe fault. Gold assays from', '-weathering, hard, listwanite. The listwanite is highly variable in colour and texture, but generally', ' in listwanite and Lexington-Grenoble Deposit. 6) Gold-bearing volcanogenic magnetite-sulfide mineralization']",5,,Quesnellia,listwanite
620d5256ad0e9c819b0797f3,,Geoarchive,NI 43-101 Technical Report for the Frasergold Project in North America dated 2009,,2009,https://www.zotero.org/groups/4530692/items/EHM7GSAN,,"[' and Quesnellia terranes. The Slide Mountain and Quesnellia terranes are part of the Intermontane Belt', ' in the Barkerville gold mining camp to the north. The Quesnellia Terrane is composed of metavolcanic', ' tectonostratigraphic terranes are present; Kootenay, Slide Mountain and Quesnellia terranes. The Slide Mountain', ' and Quesnellia terranes form part of the Intermontane Belt which has been accreted eastward onto', ' part of the Quesnellia terrane of the Intermontane Belt. Rocks of the Quesnel River Group are upper']",5,,Quesnellia,listwanite
620cf223ad0e9c819b050d39,,Geoarchive,NI 43-101 Technical Report for the Frasergold Project in North America dated 2015,,2015,https://www.zotero.org/groups/4530692/items/CTUAKBCB,,"[', Slide Mountain and Quesnellia terranes. The Slide Mountain and Quesnellia terranes are part', ', such as those in the Barkerville gold mining camp to the north. The Quesnellia', ' and Quesnellia terranes. The Slide Mountain and Quesnellia terranes form part of the Intermontane Belt', ' to middle Triassic Takla Group. The Quesnel River and Takla Groups make up part of the Quesnellia terrane', '  Intermontane Belt Quesnel (Quesnellia) Terrane  EEEEEKKKKKaaaaacccccaaaaa']",5,,Quesnellia,listwanite
620d5259ad0e9c819b079ac7,,Geoarchive,NI 43-101 Technical Report for the Boundary Falls Project in North America dated 2016,,2016,https://www.zotero.org/groups/4530692/items/4JVEQGTX,,"[' in the Omenica physiographic belt and is underlain by rocks of the Quesnellia, accreted to North America', ' metres thick. Commonly, the serpentinite bodies have undergone Fe-carbonate alteration to listwanite', ' to yellow-brown-weathering, hard, listwanite. The listwanite is highly variable in colour', ' Old Diorite  (Pkod+ Pksp  KH Old Diorite & Serpentinite  Pksp KH Serpentinite & Listwanite', ' within the Quesnellia terrane between the Grand Forks and Okanagan metamorphic core complexes. The area']",5,,Quesnellia,listwanite
